"ООО "ИМПЕРИЯ ОТДЫХА"";354071, Краснодарский Край, г. Сочи, ул. Гагарина (центральный Р-н), д.72/1 Санкт-Петербург ,ул. Почтамтская, д. 1 литер а, помещение 16н офис 15 город Санкт-Петербург, ул. Почтамтская, д. 1 литер а, помещение 16н офис 15
"ООО "ВОДНЫЙ МИР"";681006, Хабаровский Край, г. Комсомольск-На-Амуре, ул. Зейская, д. 8Сочи, ул. Фрунзе (адлерский Р-н), д.21 Краснодарский край, г. Сочи, ул. Фрунзе (адлерский Р-н), д.21
"ООО "АГЕНТСТВО АПЭК"";141707, Московская область, г. Долгопрудный, ул. Молодежная, д. 4, кв. 106ул. 50 Лет Ссср, д.76 Воронежская Область, г. Россошь, ул. 50 Лет Ссср, д.76
"АНО "БЕРИНГ"";684014, Камчатский Край, Елизовский р-н, п. Красный, ул. Шоссейная, д. 28д. 26 к. 2 кв. 440 город Москва, ул. Перерва, д. 26 к. 2 кв. 440
"ООО" ФЛАГМАН"";385000, Республика Адыгея (адыгея), г. Майкоп, ул. Крестьянская, д. 213, офис 208 аул. Мира, д. 25а, кв. 42 Саратовская область, г. Саратов, ул. Мира, д. 25а, кв. 42
"ООО ТК "ИСТОРИИ СИБИРИ"";662541, Красноярский Край, г. Лесосибирск, Прохладный пер., д. 526 к. 9 кв. 372  Г.санкт-Петербург, ул. Белградская, д. 26 к. 9 кв. 372
"ООО "БЮРО ПУТЕШЕСТВИЙ И ЭКСКУРСИЙ "КРАСНОДАРЪ"";350040, Краснодарский Край, г. Краснодар, ул. Ставропольская, д. 224, к. 1, кв. 24пр-кт Юных Пионеров, д. 120 кв. 14 Самарская Область, г. Самара, пр-кт Юных Пионеров, д. 120 кв. 14
"ООО "ЦМСП СПУТНИК"";664025, Иркутская Область, г. Иркутск, ул. Чкалова, д.39
"ООО "ПАТРИОТ-38"";664009, Иркутская Область, г. Иркутск, ул. Ширямова, д. 38  с Малая Пурга, пл Победы, д. 1 Удмуртская Республика, Малопургинский Район, с Малая Пурга, пл Победы, д. 1
"ООО "ПРИОРИТЕТ"";170100, Тверская область, г. Тверь, Тверской пр-кт, д. 6, офис 1064313104816 1024300823370 612600 Кировская Область, г. Котельнич, ул Володарского, д. 10 Кировская Область, г. Котельнич, ул Володарского, д. 10
"ООО "НИКОЛЬСКАЯ СЛОБОДА"";171571, Тверская область, г. Калязин, ул. Школьная, д. 33ул. Гагарина (центральный Р-н), д.72/1 Краснодарский Край, г. Сочи, ул. Гагарина (центральный Р-н), д.72/1
"ООО "ОСТРОВ СОЛНЦА"";445031, Самарская Область, г. Тольятти, б-р Татищева, д.21, кв.116ул. Абрикосовая (центральный Р-н), д. 19 кв. 133 Краснодарский край, г. Сочи, ул. Абрикосовая (центральный Р-н), д. 19 кв. 133
"ООО "ТЭК "ОГОНЕК"";354200, Краснодарский край, г. Сочи, ул. Станичная (лазаревский Р-н), д. 33ул. Зейская, д. 8 Хабаровский Край, г. Комсомольск-На-Амуре, ул. Зейская, д. 8
"АНО "СОБЫТИЕ"";"170006, Тверская Область, г. Тверь, ул. Дмитрия Донского, д. 35 "а", неж. Пом. 5"ул. Молодежная, д. 4 кв. 106 Московская область, г. Долгопрудный, ул. Молодежная, д. 4 кв. 106
"ООО "АУДИОГОРОД"";119071, Г.москва, ул. Малая Калужская, д. 15, стр. 1п. Красный, ул. Шоссейная, д. 28 Камчатский Край, Елизовский р-н, п. Красный, ул. Шоссейная, д. 28
"ООО "НОРД-ВЕСТ"";186790, республика Карелия, г. Сортавала, Выборгское ш., д. 66Туристический пр-д, д. 10 кв. 8 Камчатский край, г. Петропавловск-Камчатский, Туристический пр-д, д. 10 кв. 8
"ООО "ВИП-МАСТЕР"";186790, республика Карелия, г. Сортавала, Выборгское ш., д. 66Иркутск, ул. Лермонтова, д. 126а, кабинет а-201 Иркутская область, г. Иркутск, ул. Лермонтова, д. 126а, кабинет а-201
"ООО "ДАНКАМ ХОЛДИНГ"";368530, республика Дагестан, Карабудахкентский р-н, с Карабудахкент, ул. Магомеда Абужаева, д. 4ул. Чкалова, д.39 Иркутская Область, г. Иркутск, ул. Чкалова, д.39
"ООО "ГРАНД - ТУР"";308024, Белгородская Область, г Белгород, ул Королева, д. 7Апгт Красная Поляна, ул. Защитников Кавказа, д.62 Краснодарский Край, г. Сочи, пгт Красная Поляна, ул. Защитников Кавказа, д.62
"ООО "НОВАЯ ЖИЗНЬ"";680020, Хабаровский край, г. Хабаровск, пер. Дзержинского, д. 3, офис 8Тверской пр-кт, д. 6 офис 106 Тверская область, г. Тверь, Тверской пр-кт, д. 6 офис 106
"ООО "ИНТЕРАКТИВ-СПБ"";198152, город Санкт-Петербург, ул. Краснопутиловская, д. 20, литер а, кв. 59Панфиловцев, д. 3 к. 1 кв. 289 город Москва, ул. Героев Панфиловцев, д. 3 к. 1 кв. 289
"ООО "ЦЕНТР ЭКСКУРСИЙ И ТУРИЗМА"";672027, Забайкальский край, г. Чита, ул. Токмакова, д. 4, кв. 1808 к. 1 кв. 62 Г.санкт-Петербург, ул. Ленская, д. 8 к. 1 кв. 62
"ООО "КАЗАНТРИП"";420133, республика Татарстан, г. Казань, ул. Четаева, д.4, кв.22ул. Им Дышлового, д.28 Волгоградская область, г. Волгоград, ул. Им Дышлового, д.28
"ООО"АЛСУ 5"";298403, Республика Крым, г. Бахчисарай, Садовый пер., д. 12п Кутурчин, ул Пионерская, д. 12 Красноярский край, Партизанский р-н, п Кутурчин, ул Пионерская, д. 12
"ООО "АИЛ"";649113, Республика Алтай, Майминский р-н, с. Манжерок, ул. Дружбы, д. 77ул. Свободы, д.2 Ярославская Область, г. Ярославль, ул. Свободы, д.2
"АНО ИМ "ТОМСКАЯ БЕРЕСТА"";634040, Томская Область, г. Томск, ул. Владимира Высоцкого, д. 28, стр. 4, помещ. 2019Прохладный пер., д. 5 Красноярский Край, г. Лесосибирск, Прохладный пер., д. 5
"ООО "АПРИОРИ"";440072, Пензенская Область, г. Пенза, ул. Антонова, д. 17-а, кв. 92Майкоп, ул. Крестьянская, д. 213 офис 208 а Республика Адыгея (адыгея), г. Майкоп, ул. Крестьянская, д. 213 офис 208 а
"ООО "ПАСПАРТУ"";630024, Новосибирская область, г. Новосибирск, ул. Беловежская, д. 8, кв. 87Осипенко р-н, п. Херпучи, ул. Центральная, д. 1 кв. 1 Хабаровский край, Имени Полины Осипенко р-н, п. Херпучи, ул. Центральная, д. 1 кв. 1
"ООО "БОЛЬШОЙ НАЙДАН"";452941, республика Башкортостан, Краснокамский р-н, д Кузгово, ул. Центральная, д. 17ул. Карпенко, д. 5 кв. 12 Челябинская Область, г. Чебаркуль, ул. Карпенко, д. 5 кв. 12
"ООО "ТТК "ПИРАМИДА"";653039, область Кемеровская Область - Кузбасс, г. Прокопьевск, ул. Ноградская, д. 19, офис 207
"ООО "БАРКО МАРИНЕРО"";127051, город Москва, Цветной б-р, д. 30, стр. 1, пом 7 ком 16б оф 3б
"НП "ТУРИСТЫ АМУРА"";675000, Амурская Область, г. Благовещенск, ул. Б.хмельницкого, д.21
"ООО "ЭДЕМ-ТУР"";427971, Удмуртская Республика, г. Сарапул, ул Новая (дубровка Ж/р), д. 6
"ООО "ПРОЕКТ РЕТРОПОЕЗД"";119454, город Москва, ул. Удальцова, д. 79, кв. 104
"ООО "ГЛОРИЯ"";354000, Краснодарский Край, г. Сочи, ул. Горького (центральный Р-н), д.43
"ООО "ВОЛОНТЕР"";127055, город Москва, ул. Лесная, д.45а, стр.2
ООО «ПРИСТАНЬ РЫБАКА»;680000, Хабаровский край, г. Хабаровск, ул. Дикопольцева, д. 48, кв. 6
"ООО "НЕВО-БАЛТ РИВА"";199106, город Санкт-Петербург, пл. Морской Славы, д. 1, литер а, офис 307-3
"ООО "ПРИИСКОВЫЙ"";660022, Красноярский край, г. Красноярск, ул. Партизана Железняка, д. 21 а, кв. 115
"АНО "ТУРКЛУБ "ВЕРСТА"";390545, Рязанская Область, Рязанский р-н, с. Шумашь, ул. Свободы, д. 33
"ООО "ПЕТЕРБУРГСКИЙ ВЕРНИСАЖ"";196158, город Санкт-Петербург, ул. Ленсовета, д. 78, литер а, кв. 8
"ООО "ТУРНЕ РУС"";198328, город Санкт-Петербург, ул. Доблести, д.26, к.2, кв.79
"ООО "БИО РЕСУРС"";359010, республика Калмыкия, Яшалтинский р-н, с Яшалта, ул. Трудовая, д.7, кв.1
"АНО "ГУБЕРНСКОЕ КРАЕВЕДЧЕСКОЕ ОБЩЕСТВО"";141309, Московская Область, Рабочий туп., д. 12
"АНО "ЦЕНТР РАЗВИТИЯ КУЛЬТУРЫ НАРОДОВ СЕВЕРА"";445042, Самарская Область, г. Тольятти, пр-кт Степана Разина, д. 19, кв. 24
АНО «ПУТЬ К СВ. СЕРГИЮ»;141304, Московская Область, пр-кт Красной Армии, д. 127А
"ООО "ШИКРДК"";359300, Республика Калмыкия, Юстинский р-н, п. Цаган Аман, ул. Аюки-Хана, д. 17 в
"ООО "ПРЕСТИЖ-ТУР"";603159, Нижегородская область, г. Нижний Новгород, ул. Карла Маркса, д. 38, кв. 6
"ООО "НЕВАКРУИЗ"";195196, Г.санкт-Петербург, ул. Гранитная, д. 18, литер а, кв. 57
"ООО "ЯКУТ"";453365, Республика Башкортостан, Куюргазинский р-н, с. Новомурапталово, ул. Парковая, д. 10
